{
  "$schema": "https://json-schema.org/draft/2020-12/schema",
  "$id": "https://github.com/Litenova-Solutions/Engineering-Standards/schemas/composition-recipe.schema.json",
  "title": "Litenova Composition Recipe",
  "description": "One recipe in the composition catalog. The Markdown beside this file argues the shape; this file is what the validator resolves a page region against.",
  "type": "object",
  "additionalProperties": false,
  "required": [
    "schemaVersion",
    "recipe",
    "scope",
    "summary",
    "slots",
    "states",
    "rules"
  ],
  "properties": {
    "$schema": { "type": "string" },
    "schemaVersion": {
      "$comment": "Each release pins one exact shape. A consumer adopting a later release absorbs every difference at that moment, so no minor-compatible range exists between two releases. See standards/rule/core-authoring.publish-each-release-as-a-complete-contract and standards/rule/core-authoring.exclude-cross-release-compatibility-work.",
      "const": 1
    },
    "recipe": {
      "type": "string",
      "pattern": "^[a-z][a-z0-9-]*$"
    },
    "scope": {
      "$comment": "A page recipe is named by a page sidecar region. A shell recipe renders once around every page, so no page sidecar names it and the two-consumer rule counts frontends instead.",
      "type": "string",
      "enum": ["page", "shell"]
    },
    "summary": { "type": "string", "minLength": 1 },
    "slots": {
      "type": "array",
      "minItems": 1,
      "uniqueItems": true,
      "items": { "$ref": "#/$defs/slot" }
    },
    "states": {
      "type": "array",
      "minItems": 1,
      "uniqueItems": true,
      "items": { "$ref": "#/$defs/state" }
    },
    "rules": {
      "type": "array",
      "minItems": 1,
      "uniqueItems": true,
      "items": { "type": "string", "minLength": 1 }
    }
  },
  "$defs": {
    "slot": {
      "type": "object",
      "additionalProperties": false,
      "required": ["id", "holds"],
      "properties": {
        "id": {
          "type": "string",
          "pattern": "^[a-z][a-z0-9-]*$"
        },
        "holds": { "type": "string", "minLength": 1 },
        "required": { "type": "boolean" }
      }
    },
    "state": {
      "$comment": "The same closed set ui-page.schema.json names, so a recipe cannot promise a page a state no sidecar can declare.",
      "type": "string",
      "enum": [
        "loading",
        "empty",
        "error",
        "forbidden",
        "not-found",
        "pending",
        "disabled",
        "offline",
        "ready",
        "row-expanded",
        "validation-error",
        "saving",
        "saved"
      ]
    }
  }
}
